{
  "$schema": "https://json-schema.org/draft/2020-12/schema",
  "$id": "https://mathin.local/schemas/r1-courseware-source-manifest.schema.json",
  "title": "Mathin R1 P6-9 courseware source manifest",
  "type": "object",
  "additionalProperties": false,
  "required": [
    "$schema",
    "schemaVersion",
    "example",
    "mode",
    "writesAllowed",
    "networkAllowed",
    "databaseConnectionAllowed",
    "capturedFrom",
    "inventories",
    "storageAudits",
    "expected"
  ],
  "properties": {
    "$schema": { "type": "string", "minLength": 3 },
    "schemaVersion": { "const": "mathin-r1-courseware-source-manifest-v4" },
    "example": { "type": "boolean" },
    "mode": { "const": "plan-only" },
    "writesAllowed": { "const": false },
    "networkAllowed": { "const": false },
    "databaseConnectionAllowed": { "const": false },
    "capturedFrom": {
      "type": "object",
      "additionalProperties": false,
      "required": ["environment", "readOnly", "databaseFingerprint", "migrationHead", "exportedAt"],
      "properties": {
        "environment": { "const": "offline-read-only-export" },
        "readOnly": { "const": true },
        "databaseFingerprint": { "$ref": "#/$defs/sha256" },
        "migrationHead": { "type": "string", "pattern": "^[0-9]{14}_[a-z0-9_]+$" },
        "exportedAt": { "type": "string", "format": "date-time" }
      }
    },
    "inventories": {
      "type": "array",
      "minItems": 2,
      "maxItems": 2,
      "prefixItems": [
        { "$ref": "#/$defs/aixuexiInventory" },
        { "$ref": "#/$defs/eSeriesInventory" }
      ],
      "items": false
    },
    "storageAudits": {
      "type": "array",
      "minItems": 2,
      "maxItems": 2,
      "prefixItems": [
        { "$ref": "#/$defs/h5StorageAudit" },
        { "$ref": "#/$defs/objectStorageAudit" }
      ],
      "items": false
    },
    "expected": {
      "type": "object",
      "additionalProperties": false,
      "required": [
        "courseCount",
        "lectureCount",
        "nativeTrackCount",
        "adaptedTrackCount",
        "releaseCount",
        "missingBindingCount",
        "missingResourceCount",
        "storageHashMismatchCount"
      ],
      "properties": {
        "courseCount": { "const": 102 },
        "lectureCount": { "const": 1305 },
        "nativeTrackCount": { "const": 1305 },
        "adaptedTrackCount": { "const": 1305 },
        "releaseCount": { "const": 2610 },
        "missingBindingCount": { "const": 0 },
        "missingResourceCount": { "const": 0 },
        "storageHashMismatchCount": { "const": 0 }
      }
    }
  },
  "$defs": {
    "sha256": {
      "type": "string",
      "pattern": "^[0-9a-f]{64}$",
      "not": { "pattern": "^([0-9a-f])\\1{63}$" }
    },
    "uuid": {
      "type": "string",
      "pattern": "^[0-9a-fA-F]{8}-[0-9a-fA-F]{4}-[1-5][0-9a-fA-F]{3}-[89aAbB][0-9a-fA-F]{3}-[0-9a-fA-F]{12}$"
    },
    "localPath": {
      "type": "string",
      "minLength": 3,
      "maxLength": 500,
      "pattern": "^(?!/)(?![A-Za-z][A-Za-z0-9+.-]*:)(?!.*\\\\).+$"
    },
    "inventoryBase": {
      "type": "object",
      "additionalProperties": false,
      "required": ["courseSystem", "path", "sha256"],
      "properties": {
        "courseSystem": { "type": "string" },
        "path": { "$ref": "#/$defs/localPath" },
        "sha256": { "$ref": "#/$defs/sha256" }
      }
    },
    "aixuexiInventory": {
      "allOf": [
        { "$ref": "#/$defs/inventoryBase" },
        { "properties": { "courseSystem": { "const": "aixuexi-autumn" } } }
      ]
    },
    "eSeriesInventory": {
      "type": "object",
      "additionalProperties": false,
      "required": ["courseSystem", "path", "sha256", "roster"],
      "properties": {
        "courseSystem": { "const": "e-series" },
        "path": { "$ref": "#/$defs/localPath" },
        "sha256": { "$ref": "#/$defs/sha256" },
        "roster": {
          "type": "object",
          "additionalProperties": false,
          "required": ["path", "sha256"],
          "properties": {
            "path": { "const": "supabase/seed/teaching-plans.json" },
            "sha256": { "enum": ["7f4caef6fbdc1849a6ccecd678bc210bc9ce24ee2c37ebceb3bdc87ab7ed39ea", "6f89722d555d32600826a85a0ebcd31f72dd163b8f5ffa62d15fd6b7012cfe08"] }
          }
        }
      }
    },
    "storageAuditBase": {
      "type": "object",
      "additionalProperties": false,
      "required": [
        "bucket",
        "prefix",
        "objectsManifestPath",
        "objectsManifestSha256"
      ],
      "properties": {
        "bucket": { "type": "string" },
        "prefix": { "type": "string" },
        "objectsManifestPath": { "$ref": "#/$defs/localPath" },
        "objectsManifestSha256": { "$ref": "#/$defs/sha256" }
      }
    },
    "h5StorageAudit": {
      "allOf": [
        { "$ref": "#/$defs/storageAuditBase" },
        { "properties": { "bucket": { "const": "cw-h5" }, "prefix": { "const": "packages/" } } }
      ]
    },
    "objectStorageAudit": {
      "allOf": [
        { "$ref": "#/$defs/storageAuditBase" },
        { "properties": { "bucket": { "const": "cw-objects" }, "prefix": { "const": "sha256/" } } }
      ]
    },
    "lectureInventoryEntry": {
      "description": "Each LF-delimited inventory line. The executable validator applies the cross-line cardinality, ordering, hash, Storage, readiness, and source-gap invariants that JSON Schema cannot express over NDJSON.",
      "type": "object",
      "additionalProperties": false,
      "required": ["courseSystem", "course", "lecture", "source", "tracks"],
      "properties": {
        "courseSystem": { "enum": ["e-series", "aixuexi-autumn"] },
        "course": {
          "type": "object",
          "additionalProperties": false,
          "required": ["catalogVersion", "productCode", "grade"],
          "properties": {
            "catalogVersion": { "enum": ["2025", "2026", "default"] },
            "productCode": { "type": "string", "minLength": 3, "maxLength": 160 },
            "grade": { "type": "integer", "minimum": 1, "maximum": 6 }
          }
        },
        "lecture": {
          "type": "object",
          "additionalProperties": false,
          "required": ["id", "no"],
          "properties": {
            "id": { "$ref": "#/$defs/uuid" },
            "no": { "type": "integer", "minimum": 1 }
          }
        },
        "source": {
          "type": "object",
          "additionalProperties": false,
          "required": ["packageKey", "packageVersion", "packageManifestSha256", "lectureVerificationSha256", "offlineStatus"],
          "properties": {
            "packageKey": { "type": "string", "minLength": 3, "maxLength": 160 },
            "packageVersion": { "type": "string", "minLength": 3, "maxLength": 160 },
            "packageManifestSha256": { "$ref": "#/$defs/sha256" },
            "lectureVerificationSha256": { "$ref": "#/$defs/sha256" },
            "offlineStatus": { "const": "complete" }
          }
        },
        "tracks": {
          "type": "array",
          "minItems": 2,
          "maxItems": 2,
          "prefixItems": [
            { "$ref": "#/$defs/nativeTrack" },
            { "$ref": "#/$defs/adaptedTrack" }
          ],
          "items": false
        }
      }
    },
    "trackBase": {
      "type": "object",
      "additionalProperties": false,
      "required": ["track", "readiness", "pages", "pageSetSha256", "bindingSetSha256", "resourceSetSha256", "capturedRelease", "release"],
      "properties": {
        "track": { "type": "string" },
        "readiness": {
          "enum": ["native-source-verified", "approved-adaptation", "verified-16x9-projection", "verified-4x3-source-master"]
        },
        "pages": { "type": "array", "minItems": 1, "items": { "$ref": "#/$defs/page" } },
        "pageSetSha256": { "$ref": "#/$defs/sha256" },
        "bindingSetSha256": { "$ref": "#/$defs/sha256" },
        "resourceSetSha256": { "$ref": "#/$defs/sha256" },
        "capturedRelease": {
          "type": "object",
          "additionalProperties": false,
          "required": ["id", "releaseNo", "rawSnapshotSha256", "snapshotSha256"],
          "properties": {
            "id": { "$ref": "#/$defs/uuid" },
            "releaseNo": { "type": "integer", "minimum": 1 },
            "rawSnapshotSha256": {
              "description": "Canonical SHA-256 of the exact immutable cw_lecture_releases.snapshot JSON captured by the read-only exporter; it is exporter-bound and cannot be reconstructed from this offline inventory.",
              "$ref": "#/$defs/sha256"
            },
            "snapshotSha256": {
              "description": "Canonical SHA-256 of the normalized, inventory-reconstructable release snapshot projection.",
              "$ref": "#/$defs/sha256"
            }
          }
        },
        "release": {
          "type": "object",
          "additionalProperties": false,
          "required": ["releaseNo", "note", "snapshotSha256"],
          "properties": {
            "releaseNo": { "const": 1 },
            "note": { "const": "production-v1.0-baseline" },
            "snapshotSha256": { "$ref": "#/$defs/sha256" }
          }
        }
      }
    },
    "nativeTrack": {
      "allOf": [
        { "$ref": "#/$defs/trackBase" },
        { "properties": { "track": { "const": "native-16x9" } } }
      ]
    },
    "adaptedTrack": {
      "allOf": [
        { "$ref": "#/$defs/trackBase" },
        { "properties": { "track": { "const": "adapted-4x3" } } }
      ]
    },
    "page": {
      "type": "object",
      "additionalProperties": false,
      "required": ["pageNo", "pageDocId", "sourceRevisionId", "docSha256", "learningCheckEnabled", "requiredBindingKeys", "documentBindingKeysSha256", "bindings"],
      "properties": {
        "pageNo": { "type": "integer", "minimum": 1 },
        "pageDocId": { "$ref": "#/$defs/uuid" },
        "sourceRevisionId": { "$ref": "#/$defs/uuid" },
        "docSha256": { "$ref": "#/$defs/sha256" },
        "learningCheckEnabled": { "type": "boolean" },
        "requiredBindingKeys": { "type": "array", "minItems": 1, "uniqueItems": true, "items": { "$ref": "#/$defs/sha256" } },
        "documentBindingKeysSha256": { "$ref": "#/$defs/sha256" },
        "bindings": { "type": "array", "minItems": 1, "items": { "$ref": "#/$defs/binding" } }
      }
    },
    "binding": {
      "type": "object",
      "additionalProperties": false,
      "required": [
        "bindingKey",
        "assetRevisionId",
        "objectSha256",
        "kind",
        "role",
        "variant",
        "mime",
        "byteCount",
        "storageBucket",
        "storagePath",
        "h5ManifestPath",
        "h5ManifestSha256",
        "launchQuery",
        "adaptationStatus"
      ],
      "properties": {
        "bindingKey": { "$ref": "#/$defs/sha256" },
        "assetRevisionId": { "$ref": "#/$defs/uuid" },
        "objectSha256": { "$ref": "#/$defs/sha256" },
        "kind": { "enum": ["image", "video", "audio", "svg", "h5"] },
        "role": { "type": "string", "pattern": "^[a-z][a-z0-9_-]{0,49}$" },
        "variant": { "type": "string", "pattern": "^[a-z][a-z0-9._-]{0,79}$" },
        "mime": { "type": "string", "minLength": 3, "maxLength": 160 },
        "byteCount": { "type": "integer", "minimum": 1 },
        "storageBucket": { "enum": ["cw-objects", "cw-h5"] },
        "storagePath": { "type": "string", "minLength": 10, "maxLength": 500 },
        "h5ManifestPath": { "oneOf": [{ "$ref": "#/$defs/localPath" }, { "type": "null" }] },
        "h5ManifestSha256": { "oneOf": [{ "$ref": "#/$defs/sha256" }, { "type": "null" }] },
        "launchQuery": { "oneOf": [{ "$ref": "#/$defs/h5LaunchQuery" }, { "type": "null" }] },
        "adaptationStatus": { "enum": ["approved", "not-required"] }
      },
      "allOf": [
        {
          "if": { "properties": { "kind": { "const": "h5" } }, "required": ["kind"] },
          "then": { "properties": { "launchQuery": { "$ref": "#/$defs/h5LaunchQuery" } } },
          "else": { "properties": { "launchQuery": { "type": "null" } } }
        }
      ]
    },
    "h5LaunchQuery": {
      "type": "object",
      "additionalProperties": false,
      "required": ["query", "coursewareIdParam"],
      "properties": {
        "query": {
          "type": "object",
          "maxProperties": 100,
          "propertyNames": { "type": "string", "minLength": 1, "maxLength": 100 },
          "additionalProperties": {
            "type": "array",
            "maxItems": 100,
            "items": { "type": "string", "maxLength": 500 }
          }
        },
        "coursewareIdParam": {
          "oneOf": [
            { "type": "string", "minLength": 1, "maxLength": 100 },
            { "type": "null" }
          ]
        }
      }
    }
  }
}
