{
  "$schema": "schemas/r1-courseware-source-manifest.schema.json",
  "schemaVersion": "mathin-r1-courseware-source-manifest-v4",
  "example": true,
  "mode": "plan-only",
  "writesAllowed": false,
  "networkAllowed": false,
  "databaseConnectionAllowed": false,
  "capturedFrom": {
    "environment": "offline-read-only-export",
    "readOnly": true,
    "databaseFingerprint": "e28feb1f2007167befaabe272ac9e6f44acae6cb9d3f979c47005f069aa14ccd",
    "migrationHead": "20260814000300_p6_six_classroom_cleanup",
    "exportedAt": "2026-08-13T00:00:00Z"
  },
  "inventories": [
    {
      "courseSystem": "aixuexi-autumn",
      "path": "docs/manifests/r1-courseware-aixuexi.example.ndjson",
      "sha256": "4cada1cad89e3dcac150ce4c74f600440f5012fa6d9f5bd6377d5aabcaee4da0"
    },
    {
      "courseSystem": "e-series",
      "path": "docs/manifests/r1-courseware-e-series.example.ndjson",
      "sha256": "e541a62e08bff4cf759b768a172f83536bcb924f4d7ad61a555486fc5ecc53aa",
      "roster": {
        "path": "supabase/seed/teaching-plans.json",
        "sha256": "7f4caef6fbdc1849a6ccecd678bc210bc9ce24ee2c37ebceb3bdc87ab7ed39ea"
      }
    }
  ],
  "storageAudits": [
    {
      "bucket": "cw-h5",
      "prefix": "packages/",
      "objectsManifestPath": "docs/manifests/r1-courseware-cw-h5-objects.example.ndjson",
      "objectsManifestSha256": "87e0da498d6ff0c126cd7471d5ec3c89181e3833688c1958fe98054931d7a95b"
    },
    {
      "bucket": "cw-objects",
      "prefix": "sha256/",
      "objectsManifestPath": "docs/manifests/r1-courseware-cw-objects.example.ndjson",
      "objectsManifestSha256": "d9ae9965876e8581ebeb069d8a405b644832e594ac8da327fbd7d31c8eace952"
    }
  ],
  "expected": {
    "courseCount": 102,
    "lectureCount": 1305,
    "nativeTrackCount": 1305,
    "adaptedTrackCount": 1305,
    "releaseCount": 2610,
    "missingBindingCount": 0,
    "missingResourceCount": 0,
    "storageHashMismatchCount": 0
  }
}
